{"actions":[{"action_id":"create_pin","authority_scope_refs":["REQ-005","REQ-006","SCR-007","SURF-001","SURF-002","SURF-003","SURF-004"],"fields":{"actor":{"derivation":{"kind":"DIRECT_AUTHORITY"},"source_seed_refs":["SEED-85cdd056577c5a7b55b59c5a"],"value":"Client Reviewer"},"allowed_current_states":{"derivation":{"kind":"DIRECT_AUTHORITY"},"source_seed_refs":["SEED-9d8c7d713523a75ee77e6aaf"],"value":["Review request changes only the exact Version from DRAFT to IN_REVIEW.","Expected Version state revision mismatch rejects mutation and shows latest state.","APPROVED exact Versions allow existing history reads and reject pin/reply mutation."]},"authentication":{"derivation":{"kind":"DIRECT_AUTHORITY"},"source_seed_refs":["SEED-4cbfe193013a6e770e85bfad"],"value":"Only Client Reviewer creates a new pin; Designer and Client Reviewer may reply."},"business_side_effects":{"derivation":{"kind":"DIRECT_AUTHORITY"},"source_seed_refs":["SEED-441e8d3e0a46b5b803894757"],"value":"동일 attempt ID는 최대 하나의 successful comment/reply record에 매핑"},"command":{"derivation":{"kind":"DIRECT_AUTHORITY"},"source_seed_refs":["SEED-703fa04cffb79a6996405486"],"value":"Designer or Client Reviewer opens the exact-Version review canvas."},"concurrency":{"derivation":{"kind":"DIRECT_AUTHORITY"},"source_seed_refs":["SEED-397fe785723981fce974950f"],"value":"동일 message attempt ID로 duplicate comment 또는 reply record를 생성하지 않는다."},"delivery_effects":{"derivation":{"kind":"DIRECT_AUTHORITY"},"source_seed_refs":["SEED-0bf67ccb1c8d96cfa8101bb1"],"value":"thread reply 작성자에게는 자기 행동 확인 이메일을 보내지 않는다."},"expected_domain_mutation":{"derivation":{"kind":"DIRECT_AUTHORITY"},"source_seed_refs":["SEED-441e8d3e0a46b5b803894757"],"value":"동일 attempt ID는 최대 하나의 successful comment/reply record에 매핑"},"forbidden_mutations":{"derivation":{"kind":"DIRECT_AUTHORITY"},"source_seed_refs":["SEED-441e8d3e0a46b5b803894757"],"value":"동일 attempt ID는 최대 하나의 successful comment/reply record에 매핑"},"forbidden_states":{"derivation":{"kind":"DIRECT_AUTHORITY"},"source_seed_refs":["SEED-9d8c7d713523a75ee77e6aaf"],"value":["Review request changes only the exact Version from DRAFT to IN_REVIEW.","Expected Version state revision mismatch rejects mutation and shows latest state.","APPROVED exact Versions allow existing history reads and reject pin/reply mutation."]},"history_result":{"derivation":{"kind":"DIRECT_AUTHORITY"},"source_seed_refs":["SEED-8e7aac0dd759f9a61b8b707c"],"value":"Exact Version"},"idempotency":{"derivation":{"kind":"DIRECT_AUTHORITY"},"source_seed_refs":["SEED-397fe785723981fce974950f"],"value":"동일 message attempt ID로 duplicate comment 또는 reply record를 생성하지 않는다."},"input_invariants":{"derivation":{"kind":"MACHINE_DERIVED","operator":"collect_exact","source_seed_refs":["SEED-8074b355d815df0963221327","SEED-9968346c37f09b10b8a89d89","SEED-d4f8428a81f5d608960c174f"]},"source_seed_refs":["SEED-8074b355d815df0963221327","SEED-9968346c37f09b10b8a89d89","SEED-d4f8428a81f5d608960c174f"],"value":["Feedback is a point pin with a connected comment.","Image pins use normalized x/y; PDF pins use page number and normalized x/y.","Exact-Version pin/thread state: image normalized x/y; PDF page plus normalized x/y; root pin comment; append-only replies; resolution status and history; APPROVED read-only behavior; message-attempt idempotency."]},"object_binding":{"derivation":{"kind":"DIRECT_AUTHORITY"},"source_seed_refs":["SEED-9bc1d14cf6b04ecc643c5d0e"],"value":"Exact-Version pin/thread state: image normalized x/y; PDF page plus normalized x/y; root pin comment; append-only replies; resolution status and history; APPROVED read-only behavior; message-attempt idempotency."},"preconditions":{"derivation":{"kind":"DIRECT_AUTHORITY"},"source_seed_refs":["SEED-4ec3e5da36dddb73d4544042"],"value":["The actor has current project access and the exact Version is mutable for the requested action."]},"recovery":{"derivation":{"kind":"DIRECT_AUTHORITY"},"source_seed_refs":["SEED-0242ad08eddfa7b2b4235a8a"],"value":"동일 message attempt ID의 조회·재시도는 하나의 논리적 submission으로 처리하고 성공 record가 있으면 기존 record를 반환한다."},"rejection":{"derivation":{"kind":"DIRECT_AUTHORITY"},"source_seed_refs":["SEED-07c3ee5fc8648b578e618f5b"],"value":"Error withholds success and shows the applicable documented access, permission, archive, approved-state, or expected-revision rejection and recovery."},"relationship_predicate":{"derivation":{"kind":"DIRECT_AUTHORITY"},"source_seed_refs":["SEED-4cbfe193013a6e770e85bfad"],"value":"Only Client Reviewer creates a new pin; Designer and Client Reviewer may reply."},"superseded_rules":{"derivation":{"kind":"DIRECT_AUTHORITY"},"source_seed_refs":["SEED-aa3ec9cf362e8a4a27e2c217"],"value":"Client Reviewer만 새 pin comment를 생성하고 Designer와 Client Reviewer 모두 thread reply를 작성할 수 있다. Designer가 thread를 RESOLVED로 전환하며 Client Reviewer가 RESOLVED thread에 reply하면 자동 OPEN된다. comment와 thread history 삭제는 금지한다."},"trace":{"derivation":{"kind":"DIRECT_AUTHORITY"},"source_seed_refs":["SEED-ba5ac85922b87e8fb415dab0"],"value":"Pins bind normalized coordinates to exact Versions; threads are append-only/idempotent; role-specific resolve/reopen and approved read-only rules hold."},"version_result":{"derivation":{"kind":"DIRECT_AUTHORITY"},"source_seed_refs":["SEED-8e7aac0dd759f9a61b8b707c"],"value":"Exact Version"},"visible_error":{"derivation":{"kind":"DIRECT_AUTHORITY"},"source_seed_refs":["SEED-07c3ee5fc8648b578e618f5b"],"value":"Error withholds success and shows the applicable documented access, permission, archive, approved-state, or expected-revision rejection and recovery."},"visible_success":{"derivation":{"kind":"DIRECT_AUTHORITY"},"source_seed_refs":["SEED-41684fac7ad6bc4a99009bde"],"value":"Completed and success follow only authoritative confirmation."}},"ux_action_locator":{"action_key":"create_pin","screen_ref":"SCR-007"},"verification_basis":{"acceptance_basis_seed_refs":["SEED-ba5ac85922b87e8fb415dab0"],"outcome_basis_seed_refs":["SEED-07c3ee5fc8648b578e618f5b","SEED-41684fac7ad6bc4a99009bde"]}},{"action_id":"reply_thread","authority_scope_refs":["REQ-005","REQ-006","SCR-007","SURF-001","SURF-002","SURF-003","SURF-004"],"fields":{"actor":{"derivation":{"kind":"MACHINE_DERIVED","operator":"collect_exact","source_seed_refs":["SEED-65b2a6c9b4932974b3b60496","SEED-85cdd056577c5a7b55b59c5a"]},"source_seed_refs":["SEED-65b2a6c9b4932974b3b60496","SEED-85cdd056577c5a7b55b59c5a"],"value":["Workspace Owner / Designer","Client Reviewer"]},"allowed_current_states":{"derivation":{"kind":"DIRECT_AUTHORITY"},"source_seed_refs":["SEED-9d8c7d713523a75ee77e6aaf"],"value":["Review request changes only the exact Version from DRAFT to IN_REVIEW.","Expected Version state revision mismatch rejects mutation and shows latest state.","APPROVED exact Versions allow existing history reads and reject pin/reply mutation."]},"authentication":{"derivation":{"kind":"DIRECT_AUTHORITY"},"source_seed_refs":["SEED-4cbfe193013a6e770e85bfad"],"value":"Only Client Reviewer creates a new pin; Designer and Client Reviewer may reply."},"business_side_effects":{"derivation":{"kind":"DIRECT_AUTHORITY"},"source_seed_refs":["SEED-441e8d3e0a46b5b803894757"],"value":"동일 attempt ID는 최대 하나의 successful comment/reply record에 매핑"},"command":{"derivation":{"kind":"DIRECT_AUTHORITY"},"source_seed_refs":["SEED-703fa04cffb79a6996405486"],"value":"Designer or Client Reviewer opens the exact-Version review canvas."},"concurrency":{"derivation":{"kind":"DIRECT_AUTHORITY"},"source_seed_refs":["SEED-1692318ef26860b453b43d5f"],"value":"동일 message attempt ID로 duplicate comment 또는 reply record를 생성하지 않는다."},"delivery_effects":{"derivation":{"kind":"DIRECT_AUTHORITY"},"source_seed_refs":["SEED-0bf67ccb1c8d96cfa8101bb1"],"value":"thread reply 작성자에게는 자기 행동 확인 이메일을 보내지 않는다."},"expected_domain_mutation":{"derivation":{"kind":"DIRECT_AUTHORITY"},"source_seed_refs":["SEED-349df48d9ee4d3c2cc647c87"],"value":"Exact-Version pin/thread state: image normalized x/y; PDF page plus normalized x/y; root pin comment; append-only replies; resolution status and history; APPROVED read-only behavior; message-attempt idempotency."},"forbidden_mutations":{"derivation":{"kind":"DIRECT_AUTHORITY"},"source_seed_refs":["SEED-441e8d3e0a46b5b803894757"],"value":"동일 attempt ID는 최대 하나의 successful comment/reply record에 매핑"},"forbidden_states":{"derivation":{"kind":"DIRECT_AUTHORITY"},"source_seed_refs":["SEED-9d8c7d713523a75ee77e6aaf"],"value":["Review request changes only the exact Version from DRAFT to IN_REVIEW.","Expected Version state revision mismatch rejects mutation and shows latest state.","APPROVED exact Versions allow existing history reads and reject pin/reply mutation."]},"history_result":{"derivation":{"kind":"DIRECT_AUTHORITY"},"source_seed_refs":["SEED-8e7aac0dd759f9a61b8b707c"],"value":"Exact Version"},"idempotency":{"derivation":{"kind":"DIRECT_AUTHORITY"},"source_seed_refs":["SEED-397fe785723981fce974950f"],"value":"동일 message attempt ID로 duplicate comment 또는 reply record를 생성하지 않는다."},"input_invariants":{"derivation":{"kind":"MACHINE_DERIVED","operator":"collect_exact","source_seed_refs":["SEED-23f1071f8cd9cf14d4ce3e72","SEED-257257f91c773cfe5dfe3347","SEED-ed9c757cbc28c40044dfd8aa"]},"source_seed_refs":["SEED-23f1071f8cd9cf14d4ce3e72","SEED-257257f91c773cfe5dfe3347","SEED-ed9c757cbc28c40044dfd8aa"],"value":["Exact-Version pin/thread state: image normalized x/y; PDF page plus normalized x/y; root pin comment; append-only replies; resolution status and history; APPROVED read-only behavior; message-attempt idempotency.","APPROVED exact Versions reject new pin comments and all thread replies.","Only Client Reviewer creates a new pin; Designer and Client Reviewer may reply."]},"object_binding":{"derivation":{"kind":"DIRECT_AUTHORITY"},"source_seed_refs":["SEED-9bc1d14cf6b04ecc643c5d0e"],"value":"Exact-Version pin/thread state: image normalized x/y; PDF page plus normalized x/y; root pin comment; append-only replies; resolution status and history; APPROVED read-only behavior; message-att